{
  "schema_version": "0.1.0",
  "official_id": "2015122300020605",
  "original_id": "2015122300020577",
  "source": {
    "pdf_sha256": "5deb8acbdb2112f274f67c3c03e01f754fa4fc986d45c30868e16bc001532f6f",
    "page_count": 29,
    "current_id": "2015122300020605",
    "original_id": "2015122300020577",
    "correction_text": "21A 최대전환시 임대조건 (소득有) 임대조건 증액시 70,320->75,400 임대조건 감액시 8,320 ->8,400"
  },
  "review": {
    "reviewed_at": "2026-09-17",
    "method": "pdf_text_and_visual_review",
    "reviewed_scope": [
      "공고문 1·2·3·12쪽의 표시된 17개 항목"
    ],
    "unreviewed_scope": [
      "공고 전체 신청 자격·소득·자산·세대구성·우선배정",
      "별도 변경 공지 및 최종 유효성"
    ]
  },
  "facts": [
    {
      "id": "bundong3-01",
      "category": "address",
      "label": "공급 위치",
      "value": "서울시 강북구 오현로 208, 번동주공3단지 내 행복주택",
      "page": 1,
      "source_locator": "p.1 공급 위치"
    },
    {
      "id": "bundong3-02",
      "category": "schedule",
      "label": "신청 접수",
      "value": "2026.08.31 10:00 ~ 2026.09.02 17:00 (한국 시간), 인터넷·모바일 청약",
      "page": 12,
      "source_locator": "p.12 신청 접수"
    },
    {
      "id": "bundong3-03",
      "category": "schedule",
      "label": "서류제출대상자 발표",
      "value": "2026.09.28 17:00 이후 (한국 시간)",
      "page": 12,
      "source_locator": "p.12 서류제출대상자 발표"
    },
    {
      "id": "bundong3-04",
      "category": "schedule",
      "label": "선정된 서류제출대상자의 서류 접수",
      "value": "2026.09.29 09:00 ~ 2026.10.01 17:00 (한국 시간). 선정 여부 및 제출 방법은 공고문 확인",
      "page": 12,
      "source_locator": "p.12 선정된 서류제출대상자의 서류 접수"
    },
    {
      "id": "bundong3-05",
      "category": "schedule",
      "label": "당첨자 발표",
      "value": "2026.12.07 17:00 이후 (한국 시간). 자격 검색 처리에 따라 연기 가능",
      "page": 12,
      "source_locator": "p.12 당첨자 발표"
    },
    {
      "id": "bundong3-06",
      "category": "schedule",
      "label": "계약 체결",
      "value": "추후 개별통보. 웹 상세의 계약기간을 확정 계약 일정으로 사용하지 않음",
      "page": 12,
      "source_locator": "p.12 계약 체결"
    },
    {
      "id": "bundong3-07",
      "category": "rent",
      "label": "16A · 대학생 기본 임대조건",
      "value": "보증금 36,720,000원 · 월 임대료 156,060원. 보증금 원문 단위 천원을 원으로 환산",
      "page": 2,
      "source_locator": "p.2 16A · 대학생 기본 임대조건"
    },
    {
      "id": "bundong3-08",
      "category": "rent",
      "label": "21A · 대학생 기본 임대조건",
      "value": "보증금 47,600,000원 · 월 임대료 202,300원. 보증금 원문 단위 천원을 원으로 환산",
      "page": 2,
      "source_locator": "p.2 21A · 대학생 기본 임대조건"
    },
    {
      "id": "bundong3-09",
      "category": "rent",
      "label": "21A · 청년(소득 없음) 기본 임대조건",
      "value": "보증금 47,600,000원 · 월 임대료 202,300원. 보증금 원문 단위 천원을 원으로 환산",
      "page": 2,
      "source_locator": "p.2 21A · 청년(소득 없음) 기본 임대조건"
    },
    {
      "id": "bundong3-10",
      "category": "rent",
      "label": "21A · 청년(소득 있음) 기본 임대조건",
      "value": "보증금 50,400,000원 · 월 임대료 214,200원. 보증금 원문 단위 천원을 원으로 환산",
      "page": 2,
      "source_locator": "p.2 21A · 청년(소득 있음) 기본 임대조건"
    },
    {
      "id": "bundong3-11",
      "category": "rent",
      "label": "44A · 신혼부부·한부모가족 기본 임대조건",
      "value": "보증금 113,600,000원 · 월 임대료 482,800원. 보증금 원문 단위 천원을 원으로 환산",
      "page": 2,
      "source_locator": "p.2 44A · 신혼부부·한부모가족 기본 임대조건"
    },
    {
      "id": "bundong3-12",
      "category": "correction",
      "label": "21A · 청년(소득 있음) 최대 증액 전환",
      "value": "보증금 75,400,000원 · 월 임대료 89,200원. 기본 임대조건과 구분",
      "page": 2,
      "source_locator": "p.2 21A · 청년(소득 있음) 최대 증액 전환"
    },
    {
      "id": "bundong3-13",
      "category": "correction",
      "label": "21A · 청년(소득 있음) 최대 감액 전환",
      "value": "보증금 8,400,000원 · 월 임대료 336,700원. 기본 임대조건과 구분",
      "page": 2,
      "source_locator": "p.2 21A · 청년(소득 있음) 최대 감액 전환"
    },
    {
      "id": "bundong3-14",
      "category": "eligibility",
      "label": "공급 대상 개요",
      "value": "대학생·청년·신혼부부·한부모가족 계층. 대상별 세부 무주택·소득·자산 조건은 공고문 3~11쪽 확인 필요",
      "page": 1,
      "source_locator": "p.1 공급 대상 개요"
    },
    {
      "id": "bundong3-15",
      "category": "eligibility",
      "label": "예비입주자 모집",
      "value": "현재 공가 및 향후 해약세대 발생에 대비한 모집으로 입주까지 상당 기간이 소요될 수 있음",
      "page": 1,
      "source_locator": "p.1 예비입주자 모집"
    },
    {
      "id": "bundong3-16",
      "category": "rent",
      "label": "임대조건 적용 시점",
      "value": "모집공고일 기준 금액이며 실제 계약 체결 시점의 주변 시세를 반영한 변경 조건이 적용될 수 있음",
      "page": 3,
      "source_locator": "p.3 임대조건 적용 시점"
    },
    {
      "id": "bundong3-17",
      "category": "rent",
      "label": "보증금 전환 조건",
      "value": "전환은 선택사항이며 100만원 단위. 공고상 증액 전환 이율 6%, 감액 전환 이율 3.5%; 이율 변경 시 재산정",
      "page": 3,
      "source_locator": "p.3 보증금 전환 조건"
    }
  ],
  "warnings": [
    "소득·자산 가산, 세대구성, 우선배정 등 전체 자격 규칙은 구조화하지 않았습니다. 개별 적격 여부는 판단하지 않습니다.",
    "기본 금액과 선택형 최대 전환 금액을 구분해 확인하세요."
  ]
}
